id,source_website,source_label,source_url,geo_validation,author,review_date,rating,sentiment,review_text,tier1,tier2,tier3
rvw-000337,play.google.com,Google Play (com.nthgensoftware.traderev.android),https://play.google.com/store/apps/details?id=com.nthgensoftware.traderev.android&hl=en&gl=us,google_play_us_store,Erik Blaney,2026-04-19,1,negative,Slow Slow and Slow- super glitchy update,Account / Access / Login,Password Reset & Login Troubleshooting,App Login Troubleshooting
rvw-000338,play.google.com,Google Play (com.openlane.mobile.carsarriveplus),https://play.google.com/store/apps/details?id=com.openlane.mobile.carsarriveplus&hl=en&gl=us,google_play_us_store,kegan palozola,2026-04-15,1,negative,"lags, won't load, annoying process to log in, glitchs terribly. Wish my company didn't use it.",Account / Access / Login,Password Reset & Login Troubleshooting,App Login Troubleshooting
rvw-000339,play.google.com,Google Play (com.openlane.mobile.carsarriveplus),https://play.google.com/store/apps/details?id=com.openlane.mobile.carsarriveplus&hl=en&gl=us,google_play_us_store,Lay,2026-04-14,1,negative,"app functionality is terrible , constantly freezing and logging you out , makes transporters jobs harder",Account / Access / Login,Password Reset & Login Troubleshooting,App Login Troubleshooting
rvw-000340,play.google.com,Google Play (com.openlane.mobile.carsarriveplus),https://play.google.com/store/apps/details?id=com.openlane.mobile.carsarriveplus&hl=en&gl=us,google_play_us_store,Tom Pryor,2026-04-10,1,negative,worst app I have used,Account / Access / Login,Password Reset & Login Troubleshooting,App Login Troubleshooting
rvw-000341,play.google.com,Google Play (com.openlane.mobile.carsarriveplus),https://play.google.com/store/apps/details?id=com.openlane.mobile.carsarriveplus&hl=en&gl=us,google_play_us_store,Michael Polk,2026-04-09,2,negative,app crashes entirely too much,Account / Access / Login,Password Reset & Login Troubleshooting,App Login Troubleshooting
rvw-000342,play.google.com,Google Play (com.openlane.mobile.carsarriveplus),https://play.google.com/store/apps/details?id=com.openlane.mobile.carsarriveplus&hl=en&gl=us,google_play_us_store,Roman C,2026-04-09,1,negative,App freezes all the time. Most times it will not load. please fix it,Account / Access / Login,Password Reset & Login Troubleshooting,App Login Troubleshooting
rvw-000343,play.google.com,Google Play (com.openlane.mobile.carsarriveplus),https://play.google.com/store/apps/details?id=com.openlane.mobile.carsarriveplus&hl=en&gl=us,google_play_us_store,Charlie Davis,2026-04-08,1,negative,don't like the app nothing but problems. constantly freezing up while taking the pictures and keeps being hard to get into.,Account / Access / Login,Password Reset & Login Troubleshooting,App Login Troubleshooting
rvw-000344,play.google.com,Google Play (com.openlane.mobile.carsarriveplus),https://play.google.com/store/apps/details?id=com.openlane.mobile.carsarriveplus&hl=ru&gl=us,google_play_us_store,Nugo Tapie,2026-04-08,1,negative,"Terrible app. It works with constant lag, awkward software, and constant problems when logging into your account. Take a cue from Super Dispatch",Account / Access / Login,Password Reset & Login Troubleshooting,App Login Troubleshooting
rvw-000345,play.google.com,Google Play (com.openlane.mobile.carsarriveplus),https://play.google.com/store/apps/details?id=com.openlane.mobile.carsarriveplus&hl=en&gl=us,google_play_us_store,Walter Temples,2026-04-06,1,negative,needs a lot of work. continuously freezing up and taking too much time to do inspections.,"Lot Condition, Listing Status and related",Third-Party Inspection Authorization & Scheduling,Previewing/ Inspecting Vehicles
rvw-000346,play.google.com,Google Play (com.nthgensoftware.traderev.android),https://play.google.com/store/apps/details?id=com.nthgensoftware.traderev.android&hl=en&gl=us,google_play_us_store,Sergio Silva,2026-04-04,1,negative,"Update 2026-04-03: Keep pushing the users away! One more reason to use eblock. Another update/revamp, another feature gone. Can no longer share vehicle info with customers unless one pays another $699/month subscription. Update 2023-06-27: Perhaps not surprising, corporate greed strikes again. Market research, which was a great feature of the Traderev app, is now a $149/month ""service"" on top of the usual buy/sell fees. Way to go Adesa!",Membership / Licensing / Fees & Bidding Policies,"Bidding Process, Rules and Fees",Fees
rvw-000347,play.google.com,Google Play (com.openlane.mobile.carsarriveplus),https://play.google.com/store/apps/details?id=com.openlane.mobile.carsarriveplus&hl=en&gl=us,google_play_us_store,Bryan Albayeros,2026-04-03,1,negative,bad app! i have to sig in every day,Account / Access / Login,Password Reset & Login Troubleshooting,App Login Troubleshooting
rvw-000348,play.google.com,Google Play (com.openlane.mobile.carsarriveplus),https://play.google.com/store/apps/details?id=com.openlane.mobile.carsarriveplus&hl=en&gl=us,google_play_us_store,TOW-INCDIRECT,2026-04-02,5,positive,great app easy access pretty straightforward..,Account / Access / Login,Password Reset & Login Troubleshooting,App Login Troubleshooting
rvw-000001,trustpilot.com,Trustpilot (openlane.com),https://www.trustpilot.com/reviews/69cab5f9745c84e1f851508c,trustpilot_us_slug,BP,2026-03-30,1,negative,"They are denying our application…. They are denying our application because former dealer on same address had some issue with them!! bad customer service , no explanation at all and rude!!",Customer Service & Communication,Agent Professionalism & Responsiveness,Rude/Unhelpful Support
rvw-000002,apps.apple.com,"Apple App Store (1566419386, us)",https://itunes.apple.com/us/review?id=1566419386&type=Purple%20Software&reviewId=13904699397,apple_us_store,Mustirotary,2026-03-30,1,negative,Really bad. You guys updated and all things dosen’t work my driver he has to enter the password again every time.,Account / Access / Login,Password Reset & Login Troubleshooting,App Login Troubleshooting
rvw-000003,play.google.com,Google Play (com.openlane.mobile.carsarriveplus),https://play.google.com/store/apps/details?id=com.openlane.mobile.carsarriveplus&hl=en&gl=us,google_play_us_store,"Bvn Enterprises, llc",2026-03-24,1,negative,the app keeps getting stuck on fetching loads screen with the only go around being uninstall to reinstall. Doing an inspection takes longer than necessary.,"Lot Condition, Listing Status and related",Third-Party Inspection Authorization & Scheduling,Previewing/ Inspecting Vehicles
rvw-000004,apps.apple.com,"Apple App Store (1566419386, us)",https://itunes.apple.com/us/review?id=1566419386&type=Purple%20Software&reviewId=13882169321,apple_us_store,Chainslingerr,2026-03-24,1,negative,Fix the problems. The app is trash everytime i open it there’s another new problem that has occurred yall need to fix the issues thats what yall get paid to do not create new ones,Account / Access / Login,Password Reset & Login Troubleshooting,App Login Troubleshooting
rvw-000005,trustpilot.com,Trustpilot (openlane.com),https://www.trustpilot.com/reviews/69c1b306f7cb6b04721276cd,trustpilot_us_slug,P&C Auto,2026-03-23,1,negative,I have the same problem as everyone on…. I have the same problem as everyone on here. I have bought several cars on their online platform. We just bout a Ram 2500 truck with a 5.0 Condition grade and it said the frame had a green check mark and guaranteed to be as described. The truck is eat up with rust and someone covered it up with spray paint. You can hit the bed and see the rust fall out from underneath. We tried to arbitrate with no luck. They said unless it has holes in the frame it was not covered. We will definitely not buy another car from them,"Lot Condition, Listing Status and related",Lot Condition Reporting,Lot Damage
rvw-000006,play.google.com,Google Play (com.openlane.mobile.carsarriveplus),https://play.google.com/store/apps/details?id=com.openlane.mobile.carsarriveplus&hl=en&gl=us,google_play_us_store,Jason Robbins,2026-03-23,1,negative,All it does is says fetching for loads. It's been doing it for almost thirty minutes,Account / Access / Login,Password Reset & Login Troubleshooting,App Login Troubleshooting
rvw-000349,play.google.com,Google Play (com.openlane.mobile.carsarriveplus),https://play.google.com/store/apps/details?id=com.openlane.mobile.carsarriveplus&hl=en&gl=us,google_play_us_store,Adam Ford,2026-03-22,1,negative,This app crashes and constantly logs you out...absolutely ridiculous,Account / Access / Login,Password Reset & Login Troubleshooting,App Login Troubleshooting
rvw-000007,play.google.com,Google Play (com.openlane.mobile.carsarriveplus),https://play.google.com/store/apps/details?id=com.openlane.mobile.carsarriveplus&hl=en&gl=us,google_play_us_store,Adam Ford,2026-03-21,1,negative,This app crashes and constantly logs you out...absolutely ridiculous,Account / Access / Login,Password Reset & Login Troubleshooting,App Login Troubleshooting
rvw-000008,play.google.com,Google Play (com.openlane.mobile.carsarriveplus),https://play.google.com/store/apps/details?id=com.openlane.mobile.carsarriveplus&hl=en&gl=us,google_play_us_store,Ryan Gravelle,2026-03-21,1,negative,crash jam glitch over and over cant add self dispatch drives. aka managers/admins junk app. fix it already..,Customer Service & Communication,Agent Professionalism & Responsiveness,Rude/Unhelpful Support
rvw-000009,play.google.com,Google Play (com.openlane.mobile.carsarriveplus),https://play.google.com/store/apps/details?id=com.openlane.mobile.carsarriveplus&hl=en&gl=us,google_play_us_store,Darle-Ray Moore,2026-03-20,1,negative,"Sequences out of order. When walking up to a unit, key in hand. Confirm serial number, take pictures, then inside check list. NOT manually enter odometer, get out of unit to take pictures only to get back in unit to take another picture of odometer. Get out of the office and talk to REAL drivers or haulers. Not the guy in the office that hasn't done it in 30 years. (Nearby Loads) I don't need that. My TM and/or I can't turn it off",Account / Access / Login,Password Reset & Login Troubleshooting,App Login Troubleshooting
rvw-000010,play.google.com,Google Play (com.openlane.mobile.carsarriveplus),https://play.google.com/store/apps/details?id=com.openlane.mobile.carsarriveplus&hl=en&gl=us,google_play_us_store,Timothy Amberger,2026-03-20,1,negative,app is almost useless. can't log on without having to reinstall. doesn't scan small GM QR codes. constantly freezing up,Account / Access / Login,Password Reset & Login Troubleshooting,App Login Troubleshooting
rvw-000011,apps.apple.com,"Apple App Store (1566419386, us)",https://itunes.apple.com/us/review?id=1566419386&type=Purple%20Software&reviewId=13867642123,apple_us_store,Jeremiah Shamberger,2026-03-20,1,negative,Slow and lags. The app is slow and lags a lot of the time. Taking pictures during pick up makes sense but at the delivery it should give the option to say car is in the same condition as pick up or add a new picture if need be. Very time consuming taking all those pictures.,Account / Access / Login,Password Reset & Login Troubleshooting,App Login Troubleshooting
rvw-000012,play.google.com,Google Play (com.openlane.mobile.carsarriveplus),https://play.google.com/store/apps/details?id=com.openlane.mobile.carsarriveplus&hl=en&gl=us,google_play_us_store,sergiy nadal,2026-03-19,1,negative,Glitches all the time!!! unable to work at all!!!,Account / Access / Login,Password Reset & Login Troubleshooting,App Login Troubleshooting
rvw-000013,apps.apple.com,"Apple App Store (1566419386, us)",https://itunes.apple.com/us/review?id=1566419386&type=Purple%20Software&reviewId=13866440339,apple_us_store,OrehRaff,2026-03-19,2,negative,So dumb.. It has stopped working across multiple devices. Now my colleagues and I have to log back in a hundred times a day just to do our jobs and earn a living. Thanks for completely ruining the app.,Account / Access / Login,Password Reset & Login Troubleshooting,App Login Troubleshooting
rvw-000014,apps.apple.com,"Apple App Store (1566419386, us)",https://itunes.apple.com/us/review?id=1566419386&type=Purple%20Software&reviewId=13864324880,apple_us_store,Fastronaught,2026-03-19,1,negative,"Unfriendly. This app is very restrictive for the user. Pictures are forced sizes, I need to stand out in the middle of the road to fit a car in it. If you have a car by itself in the middle of a vacant parking lot you'd be ok, but not with any traffic or real life situations (bushes, walls, other cars, guardrails) It constantly closes out and makes you sign back in again time and time again. You can't just leave it running in the background and pull it up easily to retrieve a contact number to call while operating your truck. If you lose signal bc you're in a remote area the gps location to retrieve the release slip won't come up The order in which you must take photos during inspection makes you get in and out of the vehicle multiple times which adds time to each car delivered/picked up and if it's inop needing to jump the vehicle multiple times if it can't stay running Also the load board of vehicles assigned becomes confusing due to a slide scroll lists rather than a typical listed view. It shows me potential pickups I would never get rather than the ones already assigned.",Customer Service & Communication,Agent Professionalism & Responsiveness,Rude/Unhelpful Support
rvw-000350,apps.apple.com,"Apple App Store (1566419386, us)",https://apps.apple.com/us/app/id1566419386?see-all=reviews&platform=iphone&reviewId=13864324880,apple_us_store,Fastronaught,2026-03-19,1,negative,"Unfriendly. This app is very restrictive for the user. Pictures are forced sizes, I need to stand out in the middle of the road to fit a car in it. If you have a car by itself in the middle of a vacant parking lot you'd be ok, but not with any traffic or real life situations (bushes, walls, other cars, guardrails) It constantly closes out and makes you sign back in again time and time again. You can't just leave it running in the background and pull it up easily to retrieve a contact number to call while operating your truck. If you lose signal bc you're in a remote area the gps location to retrieve the release slip won't come up The order in which you must take photos during inspection makes you get in and out of the vehicle multiple times which adds time to each car delivered/picked up and if it's inop needing to jump the vehicle multiple times if it can't stay running Also the load board of vehicles assigned becomes confusing due to a slide scroll lists rather than a typical listed view. It shows me potential pickups I would never get rather than the ones already assigned",Customer Service & Communication,Agent Professionalism & Responsiveness,Rude/Unhelpful Support
rvw-000015,trustpilot.com,Trustpilot (openlane.com),https://www.trustpilot.com/reviews/69bae914bd8c26ac0a7c73a1,trustpilot_us_slug,Citybudowa Sp. z o.o.,2026-03-18,1,negative,"swindlers. Don't buy any car under any circumstances; 90% of them are painted and technically faulty. Not a single complaint has been satisfied. You can't talk to the claims department by phone, they don't respond to emails, and if they do, they're blatantly lying. I don't recommend anyone do business with them.",Customer Service & Communication,Communication Follow-up & Escalation,No Callback / Unresolved Case
rvw-000016,play.google.com,Google Play (com.openlane.mobile.carsarriveplus),https://play.google.com/store/apps/details?id=com.openlane.mobile.carsarriveplus&hl=en&gl=us,google_play_us_store,Rob W,2026-03-18,2,negative,"App worked fine for a long time, few annoying glitches here and there, nothing major. All of a sudden the app is stuck on fetching loads screen. it won't work unless I delete the app and redownload it. than once I close the app out , I must go through the process of deleting the app again for it to work..gotta do better",Account / Access / Login,Password Reset & Login Troubleshooting,App Login Troubleshooting
rvw-000017,play.google.com,Google Play (com.openlane.mobile.carsarriveplus),https://play.google.com/store/apps/details?id=com.openlane.mobile.carsarriveplus&hl=en&gl=us,google_play_us_store,David Chichinadze,2026-03-18,1,negative,"worst app ever. VERY slow, stupid engine and functionality, design, inspection process. try to copy from superdispatch app quick and informative.","Lot Condition, Listing Status and related",Third-Party Inspection Authorization & Scheduling,Previewing/ Inspecting Vehicles
rvw-000018,apps.apple.com,"Apple App Store (1566419386, us)",https://itunes.apple.com/us/review?id=1566419386&type=Purple%20Software&reviewId=13863106027,apple_us_store,thomasulrich77,2026-03-18,1,negative,"Status updates. Why are we not able to upload status update updates through the app ourselves?? Also, you guys are improperly notating vehicle descriptions in office no keys no access wheels turned all of the above a fact how we transport these vehicle vehicles There’s also no after hours communication you guys shut down while we all are still working",Customer Service & Communication,Agent Professionalism & Responsiveness,Rude/Unhelpful Support
rvw-000019,trustpilot.com,Trustpilot (openlane.com),https://www.trustpilot.com/reviews/69b97a444a7ebc35c5d2fb34,trustpilot_us_slug,Cathy Taylor-Blay,2026-03-17,1,negative,Don't deal with open lane I bought a…. Don't deal with open lane I bought a Silverado truck said no issues I went to pick up parts missing off engine and engine was locked up.i made a complaint they locked me out of my account for making a abstraction on the vehicle.then put shipping on vehicle and charged me for shipping and I picked it up and loaded it on my trailer.open lane is a scammer website that needs to be shut down there doing a lot of elegal activities,Membership / Licensing / Fees & Bidding Policies,"Bidding Process, Rules and Fees",Fees
rvw-000020,trustpilot.com,Trustpilot (openlane.com),https://www.trustpilot.com/reviews/69b865cff9cb2ad0cfb1b6ad,trustpilot_us_slug,LAL,2026-03-16,1,negative,"AUTO PAPERWORK INCOMPETENCE!. My Auto finance company sent all payoff and release of lien paperwork for a lease buyout to Openlane, Mesa AZ in May 2022. Openlane NEVER sent lien release to DMV. I had financed the buyout thru another bank, so didn't realize I had to check on the original release. Only found out when the car was totaled in 10/25 and the original lien for lease was STILL on the title!!! Of course with a zero balance. Openlane NOW wants $$ to correct their mistake and complete INCOMPETENCE!","Title, Ownership, POA and Documentation",Title Delivery & Status,Title Not Received
rvw-000021,play.google.com,Google Play (com.openlane.mobile.carsarriveplus),https://play.google.com/store/apps/details?id=com.openlane.mobile.carsarriveplus&hl=en&gl=us,google_play_us_store,Garry Brooks,2026-03-16,1,negative,Vin reader DOESN'T WORK. TOO COMPLICATED APP. SUPERDISPATCH IS THE BEST.,Account / Access / Login,Password Reset & Login Troubleshooting,App Login Troubleshooting
rvw-000022,play.google.com,Google Play (com.nthgensoftware.traderev.android),https://play.google.com/store/apps/details?id=com.nthgensoftware.traderev.android&hl=en&gl=us,google_play_us_store,GG,2026-03-14,1,negative,"Hang tight ... Loading loading loading loading loading loading... Never works as it should. The only thing that works properly is the invoicing, that never fails.",Account / Access / Login,Password Reset & Login Troubleshooting,App Login Troubleshooting
rvw-000023,play.google.com,Google Play (com.nthgensoftware.traderev.android),https://play.google.com/store/apps/details?id=com.nthgensoftware.traderev.android&hl=en&gl=us,google_play_us_store,Home,2026-03-13,1,negative,"app keeps loading and then get an error message that we are working on it, please try again later. it's been going on for a year.",Account / Access / Login,Password Reset & Login Troubleshooting,App Login Troubleshooting
rvw-000024,trustpilot.com,Trustpilot (openlane.com),https://www.trustpilot.com/reviews/69ad3b180e197c46dd288603,trustpilot_us_slug,Bobby Dzyubenko,2026-03-08,1,negative,"Trust the 1 star reviews. Trust the 1 star reviews. We own 9 stores in the PNW area and have blacklisted OpenLane for all of our buyers. We work with all major auctions and local wholesalers, yet i have never seen such an unprofessional auction house and arbitration policy, it is downright criminal. Their inspection reports are flawed to say at the least and fraudulent at best. We purchased two trucks in one week, both green light and paid for their inspection and shipping. One arrived with a check engine light, misfire issues, electronic issues and cosmetic issues; Arbitration said ""not covered, thanks for the purchase"". The second truck, we waited for 3 weeks to arrive with no updates. After 4 weeks, we started filing serious complaints. Only once we threatened a lawsuit, we were notified that the truck was sold elsewhere and the sale was cancelled, all the while they held our money and were promising delivery. Their resolution was to offer us a discount on the next purchase buyer fees. What a joke. We have officially blocked all of our stores from buying from this backlot auction.",Customer Service & Communication,Agent Professionalism & Responsiveness,Rude/Unhelpful Support
rvw-000025,apps.apple.com,"Apple App Store (1175036411, us)",https://itunes.apple.com/us/review?id=1175036411&type=Purple%20Software&reviewId=13814539868,apple_us_store,aHiNtOfcLaP,2026-03-04,1,negative,"Not worth the stress. Bug issues with the app, issues with honest listings, please do not waste your time with this business. I learned the hard way. Several times. Never changes",Account / Access / Login,Password Reset & Login Troubleshooting,App Login Troubleshooting
rvw-000026,apps.apple.com,"Apple App Store (1566419386, us)",https://itunes.apple.com/us/review?id=1566419386&type=Purple%20Software&reviewId=13813441636,apple_us_store,systempolicy,2026-03-04,1,negative,"App is constantly freezing and crashing. App is constantly freezing and crashing, even basic things like having the App home screen open cause it to freeze up. This is by far the worst app on my iPhone. All other apps work fine. CarsArrive freezes and crashes every single time. Rebooting, reinstalling never fixes it. The app is just garbage, but has to be used for work.",Account / Access / Login,Password Reset & Login Troubleshooting,App Login Troubleshooting
rvw-000027,play.google.com,Google Play (com.openlane.mobile.carsarriveplus),https://play.google.com/store/apps/details?id=com.openlane.mobile.carsarriveplus&hl=en&gl=us,google_play_us_store,Bob,2026-03-02,1,negative,the worst app I have used. I have had it take 45 minutes to download so I can inspect the car. Have the customer sign and get bol emailed. 2 days later the app shows not delivered.,Customer Service & Communication,Agent Professionalism & Responsiveness,Rude/Unhelpful Support
rvw-000028,play.google.com,Google Play (com.openlane.mobile.carsarriveplus),https://play.google.com/store/apps/details?id=com.openlane.mobile.carsarriveplus&hl=en&gl=us,google_play_us_store,Hank Boersma,2026-03-02,1,negative,too difficult to log into the app,Account / Access / Login,Password Reset & Login Troubleshooting,App Login Troubleshooting
rvw-000029,trustpilot.com,Trustpilot (openlane.com),https://www.trustpilot.com/reviews/69a0e8624c2da3d7c264a1a1,trustpilot_us_slug,Mehran Yaver,2026-02-27,1,negative,"Corrupt platform. Corrupt platform, arbitration policy is designed to favour franchise sellers, do no expect to have any support when buying AS IS vehicles does not matter what year or KM. Instead focus on buying from EBLock, at least they have proper buyer assurance program.",Customer Service & Communication,Agent Professionalism & Responsiveness,Rude/Unhelpful Support
rvw-000030,play.google.com,Google Play (com.nthgensoftware.traderev.android),https://play.google.com/store/apps/details?id=com.nthgensoftware.traderev.android&hl=en&gl=us,google_play_us_store,noel borg,2026-02-25,1,negative,"Same problems as everyone else,can't believe nothing done about it yet,been like this for over a year,Android phones don't show you instant live bids,if I'm the high bidder I can't see anybody outbidding me unless I leave that page and come back amd even then sometimes it still shows me as high bidder when there are 5 or more bids above me,come on traderev!!!! Over a year!!!!.... UPDATE... 3 years later the app is worse instead of better.... lol WOW!!",Account / Access / Login,Password Reset & Login Troubleshooting,App Login Troubleshooting
rvw-000031,play.google.com,Google Play (com.backlotcars.backlotcars),https://play.google.com/store/apps/details?id=com.backlotcars.backlotcars&hl=en&gl=us,google_play_us_store,P Bailey,2026-02-12,5,positive,"I have bought ALL my vehicles on here for the last 5 years, 920 and counting. Really have enjoyed doing business with them since they were Backlot Cars now Openlane. If you go to the auction most all of those cars are run red light nowadays but Openlane gives you 7 days or 100 miles on covered items. Its the used car business and of course you will hit bumps in the road but I wouldnt want to buy cars anywhere else honestly!",Membership / Licensing / Fees & Bidding Policies,"Bidding Process, Rules and Fees",How to Bid (First Time)
