id,source_website,source_label,source_url,geo_validation,author,review_date,rating,sentiment,review_text,tier1,tier2,tier3
rvw-000363,reddit.com,Reddit r/ComputerEngineering,https://www.reddit.com/r/ComputerEngineering/comments/1ixm2em/would_it_be_better_to_make_or_find_a_cpu/mep1v35/,mixed_source_ok,pcookie95,2025-02-25,,positive,"Assuming this is a very ambitious guy with no background knowledge and not just some troll/bot, it is technically possible to build your own CPU from scratch. Now, of course, it's not going to follow the same steps as that video, since you won't be doing any of the chemical/material science needed for chip fabrication, which is largely impossible without billions of dollars and a team of highly trained/educated scientists and engineers. However you can design and tapeout your own physical CPU with the following steps. 1. Learn digital design and HDL (e.g. verilog). This could be done via online classes such as this [edx course](https://www.edx.org/learn/design/harvey-mudd-college-digital-design). 2. Learn basic computer architecture ([edx course](https://www.edx.org/learn/computer-architecture/harvey-mudd-college-computer-architecture)) 3. Create a simple RISC-V design in HDL 4. Figure out how to use [OpenLane](https://www.zerotoasiccourse.com/terminology/openlane/) with the Skywater130 PDK (will require basic programming skills for scripting) 5. Use [Tiny Tapeout](https://tinytapeout.com/) to tapeout your own physical chip for less than 1k USD. They will send it off to a fab that handles all the complicated steps described in the video you linked at the bottom of your post. 6. You now have your own physical processor that you built from ""scratch"". Now, keep in mind that with no knowledge of computer engineering, this will take a few years to do and cost 100x more than just buying a much faster and more efficient microcontroller. But it might be worth it if you want to learn about how CPUs are made. Also note, that if you are serious about doing this, it may be worth it to go to college to get a computer engineering degree. Most degrees will teach you up to step 3. Some undergraduate programs might have a senior level class that teaches step 4, but that's usually more of graduate level course. Either way, a computer engineering degree could turn a potential hobby/interest into a high-paying job.",Customer Service & Communication,Agent Professionalism & Responsiveness,Helpful Support Experience
rvw-000142,play.google.com,Google Play (com.backlotcars.backlotcars),https://play.google.com/store/apps/details?id=com.backlotcars.backlotcars&hl=en&gl=us,google_play_us_store,Scott Bryan,2025-02-24,1,negative,"If you like frequent crashes and spinning wheels, then this is the App for you.",Account / Access / Login,Password Reset & Login Troubleshooting,App Login Troubleshooting
rvw-000143,trustpilot.com,Trustpilot (openlane.com),https://www.trustpilot.com/reviews/67ae7e93c18b90aade6a478a,trustpilot_us_slug,customer,2025-02-14,1,negative,"customer service, Arbitration , Junks Units. Customer service is very bad and plus Arbitration service is next level bad very rude when you started with . buyer fees and prices is extreamly high alot of liers and dishonest employees sells junk units . Green Lights is Joke . ACV auction is best and their customer service is best",Customer Service & Communication,Agent Professionalism & Responsiveness,Rude/Unhelpful Support
rvw-000144,play.google.com,Google Play (com.openlane.mobile.carsarriveplus),https://play.google.com/store/apps/details?id=com.openlane.mobile.carsarriveplus&hl=ru&gl=us,google_play_us_store,Truck,2025-02-13,1,negative,"dont working, can't make inspection while delivering","Lot Condition, Listing Status and related",Third-Party Inspection Authorization & Scheduling,Previewing/ Inspecting Vehicles
rvw-000145,apps.apple.com,"Apple App Store (1175036411, us)",https://itunes.apple.com/us/review?id=1175036411&type=Purple%20Software&reviewId=12295455568,apple_us_store,BigDawgMotors,2025-02-10,5,positive,"Great new app!. Great new app with ability to switch from buyer to seller with ease. Now that it will start working with different functions, so easy and clean. With the customer service team always listening to what we have to say to help the app functionality",Customer Service & Communication,Agent Professionalism & Responsiveness,Helpful Support Experience
rvw-000146,play.google.com,Google Play (com.openlane.mobile.carsarriveplus),https://play.google.com/store/apps/details?id=com.openlane.mobile.carsarriveplus&hl=en&gl=us,google_play_us_store,Jay,2025-01-30,1,negative,needs to start up faster and process the loads faster,Account / Access / Login,Password Reset & Login Troubleshooting,App Login Troubleshooting
rvw-000147,trustpilot.com,Trustpilot (openlane.com),https://www.trustpilot.com/reviews/67917cefc6be2b27ae2c6313,trustpilot_us_slug,Alex Costa,2025-01-23,1,negative,"Waiting 85 days for the delivery of a…. Waiting 85 days for the delivery of a car, many emails have already been sent and no response about the expected delivery date, this company is a shame, total disrespect to the customer!",Customer Service & Communication,Support Access & Response Time,Delayed Email/Phone Response
rvw-000148,apps.apple.com,"Apple App Store (1175036411, us)",https://itunes.apple.com/us/review?id=1175036411&type=Purple%20Software&reviewId=12199031988,apple_us_store,chapjaal,2025-01-18,1,negative,Glitches. Constantly going back to the top of listings,Account / Access / Login,Password Reset & Login Troubleshooting,App Login Troubleshooting
rvw-000149,play.google.com,Google Play (com.nthgensoftware.traderev.android),https://play.google.com/store/apps/details?id=com.nthgensoftware.traderev.android&hl=en&gl=us,google_play_us_store,Yunitube Farooqi,2025-01-12,1,negative,"No push notifications work with my android, spoke to customer support, they have no clue what to do. Filters do not work consistently. delay in bidding have lost cars due to lag on app. if your going to charge us all these fees at least make the app work. Transport fees are getting out of hand.",Customer Service & Communication,Agent Professionalism & Responsiveness,Rude/Unhelpful Support
rvw-000150,trustpilot.com,Trustpilot (openlane.com),https://www.trustpilot.com/reviews/677d98eb96afb9673604d1df,trustpilot_us_slug,J Kelley,2025-01-07,1,negative,"Small dealers get taken to the cleaners. Small dealers get taken advantage of. I am a small shop and bought a couple vehicles within a month of each other. They both needed timing repairs. They were both green lighted and had no notations on mechanical issues or the screaming howling noise that the second one had on startup. Either the inspectors are incompetent or they are just a disreputable business that takes advantage of the little guy. Now, we get to pay an extra $2500 per vehicle for the timing to be done as well as the other normal repairs that we plan on when purchasing online. Now, we will have more into both vehicles than they book out for because they don't want to do the right thing. They just lost an up and coming business. I pray that they learn to do better or more people read these reviews before using their platform.","Lot Condition, Listing Status and related",Third-Party Inspection Authorization & Scheduling,Previewing/ Inspecting Vehicles
rvw-000364,reddit.com,Reddit r/embedded,https://www.reddit.com/r/embedded/comments/1huoytx/openlane_to_test_serial_protocols/m5nfynt/,mixed_source_ok,SAI_Peregrinus,2025-01-06,,positive,"Should be. Not familiar with OpenLane, I assume you mean [this](https://github.com/efabless/openlane2) and not [this road lane map dataset](https://github.com/OpenDriveLab/OpenLane) or [this used car marketplace](https://www.openlane.com/)? An ASIC design framework that can't be used to implement the most common serial communication protocols is pretty useless. Though I do think it'd be hard to implement them via the used car dealer, so you should probably clarify which OpenLane you mean!",Customer Service & Communication,Agent Professionalism & Responsiveness,Helpful Support Experience
rvw-000151,apps.apple.com,"Apple App Store (1175036411, us)",https://itunes.apple.com/us/review?id=1175036411&type=Purple%20Software&reviewId=12113196103,apple_us_store,tsiparlana,2024-12-27,2,negative,"App issues. They just can not get the filters to work right. So many functions on the app that used to work, no longer work. I constantly have to reapply the filters to get them to work. The more features they add, the worse the functionality gets. Absolutely hate absolute sale. Wait for days for seller response, only for cars to get run up in absolute sale. Only benefits sellers.",Customer Service & Communication,Agent Professionalism & Responsiveness,Rude/Unhelpful Support
rvw-000365,apps.apple.com,"Apple App Store (1175036411, us)",https://apps.apple.com/us/app/id1175036411?see-all=reviews&platform=iphone&reviewId=12113196103,apple_us_store,tsiparlana,2024-12-27,2,negative,"App issues. They just can not get the filters to work right. So many functions on the app that used to work, no longer work. I constantly have to reapply the filters to get them to work. The more features they add, the worse the functionality gets. Absolutely hate absolute sale. Wait for days for seller response, only for cars to get run up in absolute sale. Only benefits sellers",Customer Service & Communication,Agent Professionalism & Responsiveness,Rude/Unhelpful Support
rvw-000152,bbb.org,BBB Complaints,https://www.bbb.org/us/in/carmel/profile/car-dealers/openlane-inc-0382-90024496/complaints#0382_90024496_22712003,bbb_us_business,BBB complainant,2024-12-19,1,negative,"Service or Repair Issues. I purchased a 2016 dodge dart on the Openlane platform on 11/22/2024. The inspection stated that the tires needed to be replaced and there was some peeling paint. I purchased the car for $3400 plus $225 buy fee, $75 guarantee fee and $540 delivery fee. The selling dealership is REMOVED . Upon receiving the car I could tell the car was in poor condition. The entire exhaust system was missing. Motor mounts missing. The car needs $3083 to make the car safe, not fix all issues. I contacted Openlane and they said none of these issues are covered. I did more research of this car and it turns out it sold the day before I bought it at a salvage auction REMOVED for $285. It described the car as a total loss. I called the auction. They said the seller cancelled the sale the day before I bought the car. They said there was not any negative title branding but the car did not run. I contacted the prior owner that sold it to REMOVED and they said they sold it red light, non running condition to REMOVED . I took this information to Openlane and they stated again that these issues have nothing to do with the auction and is not subject to arbitration. I have physical proof that this car was misrepresented. I called REMOVED and asked him about the car and he brushed me off to one of his employees. The employee stated that the car did not run but he had one of his guys out back get the car running. He said he never test drove the vehicle. So he repaired a vehicle without a repair facility license. All of this was brought to the attention of Openlane. I got scolded for calling the seller and they kicked me off their platform. I was told that REMOVED sells 1200 cars a year on their platform and he is a priority seller. They denied any of my claims. They will not return my calls or emails. REMOVED has offered to buy the car back but Openlane will not let them. Openlane does not care that a small dealer will lose over $3000. Nobody cares",Customer Service & Communication,Agent Professionalism & Responsiveness,Rude/Unhelpful Support
rvw-000153,trustpilot.com,Trustpilot (openlane.com),https://www.trustpilot.com/reviews/6763376b6448eca887cded2e,trustpilot_us_slug,Pat Mooney.,2024-12-18,1,negative,"Run away from this auction platform as fast as you can!. I just paid $18,135 for a late model, low mileage vehicle that, when delivered to me, clearly had a large amount of bondo in one body panel, this body panel and both bumper covers had been repainted poorly. None of this was listed on the condition report! They offered me $200 in arbitration............. Either the people doing the condition reports are hugely inexperienced/incompetent, or they're taking money from someone so as to overlook glaring problems. Either way it is absolutely buyer beware, no matter whether you're buying a cheap car or a more expensive vehicle. An auction lives or dies by their condition reports in this modern online auction system, DO NOT TRUST THIS AUCTION PLATFORM!","Lot Condition, Listing Status and related",Lot Condition Reporting,Lot Damage
rvw-000154,play.google.com,Google Play (com.openlane.mobile.carsarriveplus),https://play.google.com/store/apps/details?id=com.openlane.mobile.carsarriveplus&hl=en&gl=us,google_play_us_store,Brett Calonge,2024-12-17,1,negative,app sucks having to receive a email code every time you log in .,Customer Service & Communication,Agent Professionalism & Responsiveness,Rude/Unhelpful Support
rvw-000155,apps.apple.com,"Apple App Store (1566419386, us)",https://itunes.apple.com/us/review?id=1566419386&type=Purple%20Software&reviewId=12053042360,apple_us_store,Ckistian,2024-12-11,5,positive,Very good. The app has everything I need clearly and easily!,Account / Access / Login,Password Reset & Login Troubleshooting,App Login Troubleshooting
rvw-000156,apps.apple.com,"Apple App Store (1566419386, us)",https://itunes.apple.com/us/review?id=1566419386&type=Purple%20Software&reviewId=12051979162,apple_us_store,75934567,2024-12-11,1,negative,New update is glitchy. The new update now won’t proceed to inspection after VIN scan. I have to force close the app and open it again to start the inspection after VIN scan,"Lot Condition, Listing Status and related",Third-Party Inspection Authorization & Scheduling,Previewing/ Inspecting Vehicles
rvw-000366,play.google.com,Google Play (com.nthgensoftware.traderev.android),https://play.google.com/store/apps/details?id=com.nthgensoftware.traderev.android&hl=en&gl=us,google_play_us_store,Raad Al-Husban,2024-11-30,1,negative,Searches don't work most of the time. Bidding button doesn't work on active auctions (trade rev),Membership / Licensing / Fees & Bidding Policies,"Bidding Process, Rules and Fees",Fees
rvw-000157,play.google.com,Google Play (com.nthgensoftware.traderev.android),https://play.google.com/store/apps/details?id=com.nthgensoftware.traderev.android&hl=en&gl=us,google_play_us_store,Raad Al-Husban,2024-11-29,1,negative,Searches don't work most of the time. Bidding button doesn't work on active auctions (trade rev),Membership / Licensing / Fees & Bidding Policies,"Bidding Process, Rules and Fees",Fees
rvw-000158,play.google.com,Google Play (com.nthgensoftware.traderev.android),https://play.google.com/store/apps/details?id=com.nthgensoftware.traderev.android&hl=en&gl=us,google_play_us_store,joey Sims,2024-11-29,2,negative,Filters do not work. Buggy. Call center is useless...they have a monopoly and they know it....lack of funding for user experience is very apparent.,Customer Service & Communication,Agent Professionalism & Responsiveness,Rude/Unhelpful Support
rvw-000159,play.google.com,Google Play (com.nthgensoftware.traderev.android),https://play.google.com/store/apps/details?id=com.nthgensoftware.traderev.android&hl=en&gl=us,google_play_us_store,Jack,2024-11-29,1,negative,It doesn't work properly with android! You can't see the list with the cars you are bidding on...fix it,Membership / Licensing / Fees & Bidding Policies,"Bidding Process, Rules and Fees",Fees
rvw-000160,play.google.com,Google Play (com.openlane.mobile.carsarriveplus),https://play.google.com/store/apps/details?id=com.openlane.mobile.carsarriveplus&hl=en&gl=us,google_play_us_store,M Wagner,2024-11-22,1,negative,needs updated bad!!!!!!! Vin number reader absolutely sucks !!!!!!!!!,Account / Access / Login,Password Reset & Login Troubleshooting,App Login Troubleshooting
rvw-000161,apps.apple.com,"Apple App Store (1566419386, us)",https://itunes.apple.com/us/review?id=1566419386&type=Purple%20Software&reviewId=11936543776,apple_us_store,Alahras,2024-11-10,1,negative,"Very bad app. Keep lost the loads ,very slow assign the load and most of the time when they assign the load does not show up on my side keep give us hard time to get the load",Account / Access / Login,Password Reset & Login Troubleshooting,App Login Troubleshooting
rvw-000162,play.google.com,Google Play (com.openlane.mobile.carsarriveplus),https://play.google.com/store/apps/details?id=com.openlane.mobile.carsarriveplus&hl=en&gl=us,google_play_us_store,Adp,2024-10-30,1,negative,This app sucks i hate it so much I won't even have enough space to write all the things that are wrong with it.,Account / Access / Login,Password Reset & Login Troubleshooting,App Login Troubleshooting
rvw-000163,play.google.com,Google Play (com.openlane.mobile.carsarriveplus),https://play.google.com/store/apps/details?id=com.openlane.mobile.carsarriveplus&hl=en&gl=us,google_play_us_store,Rick Ellison,2024-10-29,1,negative,"Horrible app and company is not easy to work with, poor communication as well as charging you to get the money you worked for. Stay away if you can.",Customer Service & Communication,Agent Professionalism & Responsiveness,Rude/Unhelpful Support
rvw-000367,play.google.com,Google Play (com.openlane.mobile.carsarriveplus),https://play.google.com/store/apps/details?id=com.openlane.mobile.carsarriveplus&hl=en&gl=us,google_play_us_store,Rigo Rangel,2024-10-25,1,negative,"i delivered a vehicle, I did the inspection, customer signed. and now it shows not delivered. 1/5","Lot Condition, Listing Status and related",Third-Party Inspection Authorization & Scheduling,Previewing/ Inspecting Vehicles
rvw-000164,play.google.com,Google Play (com.openlane.mobile.carsarriveplus),https://play.google.com/store/apps/details?id=com.openlane.mobile.carsarriveplus&hl=en&gl=us,google_play_us_store,Rigo Rangel,2024-10-24,1,negative,"i delivered a vehicle, I did the inspection, customer signed. and now it shows not delivered. 1/5","Lot Condition, Listing Status and related",Third-Party Inspection Authorization & Scheduling,Previewing/ Inspecting Vehicles
rvw-000165,play.google.com,Google Play (com.openlane.mobile.carsarriveplus),https://play.google.com/store/apps/details?id=com.openlane.mobile.carsarriveplus&hl=en&gl=us,google_play_us_store,Christina OBanion,2024-10-19,1,negative,this app sucks. it never works right for me.,Account / Access / Login,Password Reset & Login Troubleshooting,App Login Troubleshooting
rvw-000166,apps.apple.com,"Apple App Store (1566419386, us)",https://itunes.apple.com/us/review?id=1566419386&type=Purple%20Software&reviewId=11833737967,apple_us_store,Consciousman,2024-10-14,1,negative,Needs Work. This app is one of the worst apps you can use as a carrier/transporter. I have ignored so many loads just because it doesn’t like all the other transportation apps. Over 6000 carrier and 20000 trucks they claim but the app is built like an owner operator app. Can do better. Or maybe it’s built that way to create issues to give them reasons not to pay carriers.,Account / Access / Login,Password Reset & Login Troubleshooting,App Login Troubleshooting
rvw-000167,play.google.com,Google Play (com.openlane.mobile.carsarriveplus),https://play.google.com/store/apps/details?id=com.openlane.mobile.carsarriveplus&hl=en&gl=us,google_play_us_store,Michael Ayala sr.,2024-10-13,3,positive,"Worked fine at first but not i can't book no loads says server is down after the last update, I even deleted the app twice reinstalled it and still can't book loads now i have to go through the website which aint to phone friendly",Account / Access / Login,Password Reset & Login Troubleshooting,App Login Troubleshooting
rvw-000368,reddit.com,Reddit r/UsedCars,https://www.reddit.com/r/UsedCars/comments/1g0xxl8/dealers_take_a_look_at_this_dealer_auction/,mixed_source_ok,gg19197,2024-10-11,,negative,"Dealers, take a look at this dealer auction😂😂 I own a small dealership and was looking to purchase this 2007 Lexus RX I saw on openlane. I just sold the same car last week which was a 2008, and driven about 10k miles less. Before auction fee I paid $8400, about $9k after fees (manheim). I had my top bid set for this 2007 at $7900, after fees and recon I would be around $8500 on it, hoping to retail it for around $10,500. I was top bid for $7400, take a look at the sellers counter offer. 😂😂 Why do franchise dealers want retail prices at a wholesale dealer only auction?? Go sell it yourself if you want retail for it. I really don't understand this one, he is literally asking for retail.",Membership / Licensing / Fees & Bidding Policies,"Bidding Process, Rules and Fees",Fees
rvw-000168,play.google.com,Google Play (com.nthgensoftware.traderev.android),https://play.google.com/store/apps/details?id=com.nthgensoftware.traderev.android&hl=en&gl=us,google_play_us_store,femy femat,2024-10-09,1,negative,"Android users don't receive alerts except on IPhone, i found out the hard way. 5years ago this app was efficient now it's the opposite, you often need to refresh your screen as the timer doesn't always update. Tech support is inefficient, client care keeps emailing you but tech support the you actually need doesn't contact you or resolve the problem for as much as 30days, been using this app for over 10 Years and it has never been this bad. Quality should be improving not declining.",Customer Service & Communication,Agent Professionalism & Responsiveness,Rude/Unhelpful Support
rvw-000169,bbb.org,BBB Complaints,https://www.bbb.org/us/in/carmel/profile/car-dealers/openlane-inc-0382-90024496/complaints#0382_90024496_22388217,bbb_us_business,BBB complainant,2024-10-06,1,negative,"Service or Repair Issues. I purchased a vehicle through Openlaness online dealer auction for the first time. The whole look and appeal of the website was very clean and easy to use. Theres even options to see vehicles with no issues what so ever but unfortunately this is not the case. The vehicle I purchased clearly stated that it had NO ISSUES and thats why I bid on the vehicle until I won. As soon as the vehicle was shipped to me I attempted to drive to the gas station to put in gas and immediately felt the 1st gear slip then the second gear slip then the third. The irony is I was on the phone with my Openlane REMOVED to tell him how happy I was with the ease of buying with Openlane was. So there is an actual recording of my live as it happened, response to me finding out that they just sold me a vehicle with a bad transmission. The following week when Arbitration called, they told me that they would give me an Adjustment of $95/hr for paying a mechanic to REMOVED lace the transmission. Now, I dont know what year that $95/hr for mechanic labor rates quote was from but here, in REMOVED 2024, I can assure you its not $95/hr! I told the Arbitration REMOVED I dont understand so he REMOVED eated what he said. Then I told him, had Id known the REMOVED was bad I wouldnt even have bid $100 as I do not have the luxury of mechanics or parking space for junk cars, how do I return this car?. He stated they can only give me an adjustment with parts and labor totaling $985. I not good at math but Labor + a New REMOVED + the time lost dealing with this their false advertising = does not equal $985. If you are a dealer I highly suggest you stick with Manheim as their Green Light Guaranteed actually means Green Light Guaranteed! But wait theres more let me tell you about my 2nd No Issues No Engine Codes blunder from Openlane! Keep in mind this is my first time buying from Openlane so you would think my next purchase would be smooth sailing right? REMOVED ! The next purchase was so much of a cluster fck that on a",Customer Service & Communication,Agent Professionalism & Responsiveness,Rude/Unhelpful Support
rvw-000170,apps.apple.com,"Apple App Store (1566419386, us)",https://itunes.apple.com/us/review?id=1566419386&type=Purple%20Software&reviewId=11798026593,apple_us_store,Every day app user 4,2024-10-04,1,negative,"Worse app ever in use for transport drivers. Looks like all reviews are fake, not from real drivers the worse app ever seen in car transport business. With 9 pictures only for the pick up inspection, you will never protect yourself. Pickup inspection takes five times more of your time. Most of the time the vin number not scan, if it’s not scanned you have to type all 17 digits manually. You can say why not just copy them, but they provide only last 8 digits of the vin🤯. I wish this app will be banned.!!!!","Lot Condition, Listing Status and related",Third-Party Inspection Authorization & Scheduling,Previewing/ Inspecting Vehicles
rvw-000369,apps.apple.com,"Apple App Store (1566419386, us)",https://itunes.apple.com/us/review?id=1566419386&type=Purple%20Software&reviewId=11797056266,apple_us_store,Chug1966,2024-10-04,1,negative,Awful. Awful worst app out there hard to navigate super dispatch is the best,Account / Access / Login,Password Reset & Login Troubleshooting,App Login Troubleshooting
rvw-000171,apps.apple.com,"Apple App Store (1566419386, us)",https://itunes.apple.com/us/review?id=1566419386&type=Purple%20Software&reviewId=11783355610,apple_us_store,Brtllc,2024-09-30,2,negative,App. App won’t let me search loads I have to search on desk top than search for the load I find via load ID on the app,Account / Access / Login,Password Reset & Login Troubleshooting,App Login Troubleshooting
