id,source_website,source_label,source_url,geo_validation,author,review_date,rating,sentiment,review_text,tier1,tier2,tier3
rvw-000233,play.google.com,Google Play (com.openlane.mobile.carsarriveplus),https://play.google.com/store/apps/details?id=com.openlane.mobile.carsarriveplus&hl=en&gl=us,google_play_us_store,Scott M,2023-12-08,1,negative,"This app is rather frustrating, in that it can't scan most QR codes, such as are used by GM. It struggles with a lot of other barcodes as well.",Account / Access / Login,Password Reset & Login Troubleshooting,App Login Troubleshooting
rvw-000388,reddit.com,Reddit r/ECE,https://www.reddit.com/r/ECE/comments/18a1g8i/help_with_learning_openlane/,mixed_source_ok,NovaFangs,2023-12-03,,positive,Help with learning OpenLane Hi I’m a second year student in ECE and i recently came to know about open source tools like OpenLane and Yosys. Are there any good tutorials to learn how to use these tools because the documentation is a bit overwhelming haha. I know a fair bit of system verilog and have hands on experience with intel quartus prime and their fpgas. Any other suggestions are also welcome. Thank you!,Account / Access / Login,Document Upload & Verification,Upload Troubleshooting
rvw-000234,play.google.com,Google Play (com.openlane.mobile.carsarriveplus),https://play.google.com/store/apps/details?id=com.openlane.mobile.carsarriveplus&hl=en&gl=us,google_play_us_store,Otto Nabih,2023-11-28,4,positive,Only wish they displayed the cost after load is accepted.,Membership / Licensing / Fees & Bidding Policies,"Bidding Process, Rules and Fees",Fees
rvw-000235,play.google.com,Google Play (com.nthgensoftware.traderev.android),https://play.google.com/store/apps/details?id=com.nthgensoftware.traderev.android&hl=en&gl=us,google_play_us_store,Andrew Fagan,2023-11-17,1,negative,App crashes 100% of the time when adjusting filters on marketplace since updating.,Account / Access / Login,Password Reset & Login Troubleshooting,App Login Troubleshooting
rvw-000236,apps.apple.com,"Apple App Store (1566419386, us)",https://itunes.apple.com/us/review?id=1566419386&type=Purple%20Software&reviewId=10574182975,apple_us_store,Boskyw,2023-11-11,2,negative,Problems with the app. The camera is off the template on the camera doesn’t match up with the picture of the vehicle it was confusing how to go to the next panel to highlight the damage one the panels,"Lot Condition, Listing Status and related",Lot Condition Reporting,Lot Damage
rvw-000237,play.google.com,Google Play (com.openlane.mobile.carsarriveplus),https://play.google.com/store/apps/details?id=com.openlane.mobile.carsarriveplus&hl=en&gl=us,google_play_us_store,Alex Matlashevsky,2023-11-03,1,negative,most difficult and confusing app to use,Account / Access / Login,Password Reset & Login Troubleshooting,App Login Troubleshooting
rvw-000389,play.google.com,Google Play (com.nthgensoftware.traderev.android),https://play.google.com/store/apps/details?id=com.nthgensoftware.traderev.android&hl=en&gl=us,google_play_us_store,Farhan Ah,2023-11-03,1,negative,Keeps crashing on android,Account / Access / Login,Password Reset & Login Troubleshooting,App Login Troubleshooting
rvw-000238,play.google.com,Google Play (com.nthgensoftware.traderev.android),https://play.google.com/store/apps/details?id=com.nthgensoftware.traderev.android&hl=en&gl=us,google_play_us_store,Farhan Ah,2023-11-02,1,negative,Keeps crashing on android,Account / Access / Login,Password Reset & Login Troubleshooting,App Login Troubleshooting
rvw-000239,play.google.com,Google Play (com.openlane.mobile.carsarriveplus),https://play.google.com/store/apps/details?id=com.openlane.mobile.carsarriveplus&hl=en&gl=us,google_play_us_store,Joe Khan,2023-10-23,3,positive,the app is a little difficult to navigate. too complicated. not so user-friendly.,Account / Access / Login,Password Reset & Login Troubleshooting,App Login Troubleshooting
rvw-000240,apps.apple.com,"Apple App Store (1566419386, us)",https://itunes.apple.com/us/review?id=1566419386&type=Purple%20Software&reviewId=10497922983,apple_us_store,Fif go oh D j FC b G D,2023-10-20,1,negative,"Hot garbage. This app, along with anything not Super Dispatch, is just a drag on time. It’s is still unable to use the flash properly. Scanning VINs is a pain at best, and when that fails you have gone from last 6 of the VIN to wanting all 17 characters to verify. There’s no need for the camera to ever not be in landscape. I could spend near an hour nit picking the flaws, but I need to go waste time typing VINs and holding my own flashlight to check in freight. Just go download Super Dispatch and do that, or even better, get rid of your app and just use theirs instead.",Account / Access / Login,Password Reset & Login Troubleshooting,App Login Troubleshooting
rvw-000241,play.google.com,Google Play (com.nthgensoftware.traderev.android),https://play.google.com/store/apps/details?id=com.nthgensoftware.traderev.android&hl=en&gl=us,google_play_us_store,Believe,2023-10-16,1,negative,Doesn't work well at all an Android. Keeps freezing or refusing to log in.,Account / Access / Login,Password Reset & Login Troubleshooting,App Login Troubleshooting
rvw-000242,play.google.com,Google Play (com.openlane.mobile.carsarriveplus),https://play.google.com/store/apps/details?id=com.openlane.mobile.carsarriveplus&hl=en&gl=us,google_play_us_store,Unit Elevator,2023-10-10,1,negative,"Guys, I working with you .. but your APP is nightmare.. limited pictures, I can't mark the damage correctly. Your program doesn't allow you to do this. If I'm in a bad zone, the App doesn't work. The best program now is the Super Dispatch program. Everything is simple, works quickly and correctly. and there are never any problems","Lot Condition, Listing Status and related",Lot Condition Reporting,Lot Damage
rvw-000243,play.google.com,Google Play (com.nthgensoftware.traderev.android),https://play.google.com/store/apps/details?id=com.nthgensoftware.traderev.android&hl=en&gl=us,google_play_us_store,N Dolic,2023-10-07,1,negative,This went downhill fast. The app is a dumpster and the staff is clueless and don't speak English. Their screw-ups cost us unnecessary experiences,Customer Service & Communication,Agent Professionalism & Responsiveness,Rude/Unhelpful Support
rvw-000244,play.google.com,Google Play (com.nthgensoftware.traderev.android),https://play.google.com/store/apps/details?id=com.nthgensoftware.traderev.android&hl=en&gl=us,google_play_us_store,Rahul Patel,2023-10-02,1,negative,App keeps crashing. Can't view cars as multiple errors come up. The car list always always goes back up to the top if you want to view a car in detail. Very annoying app for android.,"Vehicle Pickup, Delivery and Scheduling",Delivery Coordination & Handoffs,Delivery Status and ETA
rvw-000245,apps.apple.com,"Apple App Store (1175036411, us)",https://itunes.apple.com/us/review?id=1175036411&type=Purple%20Software&reviewId=10431965730,apple_us_store,Gmes85,2023-10-02,1,negative,"They don’t fulfill their obligations.. I bought the car, and the inspection report had no issues were pointed out that I later encountered, such as a falling off bumper and a hood that doesn’t close properly. They denied me the warranty, even though I paid for it. When a mechanic started looking into the car issue deeply, it turned out that the entire front part of the car was misaligned and needed adjustment.","Lot Condition, Listing Status and related",Third-Party Inspection Authorization & Scheduling,Previewing/ Inspecting Vehicles
rvw-000390,apps.apple.com,"Apple App Store (1175036411, us)",https://apps.apple.com/us/app/id1175036411?see-all=reviews&platform=iphone&reviewId=10431965730,apple_us_store,Gmes85,2023-10-02,1,negative,"They don’t fulfill their obligations.. I bought the car, and the inspection report had no issues were pointed out that I later encountered, such as a falling off bumper and a hood that doesn’t close properly. They denied me the warranty, even though I paid for it. When a mechanic started looking into the car issue deeply, it turned out that the entire front part of the car was misaligned and needed adjustment","Lot Condition, Listing Status and related",Third-Party Inspection Authorization & Scheduling,Previewing/ Inspecting Vehicles
rvw-000246,apps.apple.com,"Apple App Store (1566419386, us)",https://itunes.apple.com/us/review?id=1566419386&type=Purple%20Software&reviewId=10421074649,apple_us_store,azikiin,2023-09-29,1,negative,this app is sooooo bad to used :(( probably app was created by amateur 🤣. bad bad app,Account / Access / Login,Password Reset & Login Troubleshooting,App Login Troubleshooting
rvw-000247,apps.apple.com,"Apple App Store (1566419386, us)",https://itunes.apple.com/us/review?id=1566419386&type=Purple%20Software&reviewId=10417203558,apple_us_store,Mr.Vanity32,2023-09-28,4,positive,Low rates. Just always really low rates on the units and there is no bidding on them to get a better rate .,Membership / Licensing / Fees & Bidding Policies,"Bidding Process, Rules and Fees",How to Bid (First Time)
rvw-000248,apps.apple.com,"Apple App Store (1566419386, us)",https://itunes.apple.com/us/review?id=1566419386&type=Purple%20Software&reviewId=10412191510,apple_us_store,cata8766,2023-09-27,5,positive,"Review. It does not specified if the vehicle is at an auction dealer or repo and wont tell you the same for destination, also wont let you cancel in case you need to",Membership / Licensing / Fees & Bidding Policies,"Bidding Process, Rules and Fees",How to Bid (First Time)
rvw-000249,apps.apple.com,"Apple App Store (1566419386, us)",https://itunes.apple.com/us/review?id=1566419386&type=Purple%20Software&reviewId=10411379587,apple_us_store,Murl Trane,2023-09-26,1,negative,Not a easy app. It’s hard to understand and use. Not much instructions with it. It does not help that cars arrive doesn’t help you with it either. The app doesn’t give you all you need and cars arrive won’t help you. I was on hold for 2 hrs. I did give my number for call back but waited 3 hrs to never get called back. There is room for improvement here as long as the tech guy stays out of it and lets blue collar tell him what we need,Customer Service & Communication,Support Access & Response Time,Long Hold Time / Hard to Reach Support
rvw-000391,play.google.com,Google Play (com.backlotcars.backlotcars),https://play.google.com/store/apps/details?id=com.backlotcars.backlotcars&hl=en&gl=us,google_play_us_store,Bret Dalton,2023-09-19,1,negative,"App makes it very difficult to look at cars. Every time I click on a car and then try to go back to the search, it scrolls all the way to the top of the list and I have to find where I was again.",Account / Access / Login,Password Reset & Login Troubleshooting,App Login Troubleshooting
rvw-000250,play.google.com,Google Play (com.backlotcars.backlotcars),https://play.google.com/store/apps/details?id=com.backlotcars.backlotcars&hl=en&gl=us,google_play_us_store,Bret Dalton,2023-09-18,1,negative,"App makes it very difficult to look at cars. Every time I click on a car and then try to go back to the search, it scrolls all the way to the top of the list and I have to find where I was again.",Account / Access / Login,Password Reset & Login Troubleshooting,App Login Troubleshooting
rvw-000251,play.google.com,Google Play (com.openlane.mobile.carsarriveplus),https://play.google.com/store/apps/details?id=com.openlane.mobile.carsarriveplus&hl=en&gl=us,google_play_us_store,"Express Auto Transport, Inc",2023-09-11,1,negative,a lot of bugs and flaws in design. was not designed by car haulers.,Account / Access / Login,Password Reset & Login Troubleshooting,App Login Troubleshooting
rvw-000392,play.google.com,Google Play (com.openlane.mobile.carsarriveplus),https://play.google.com/store/apps/details?id=com.openlane.mobile.carsarriveplus&hl=en&gl=us,google_play_us_store,jackie perez,2023-09-08,1,negative,"having issues submitting paperwork, too many steps and app always freezes",Account / Access / Login,Password Reset & Login Troubleshooting,App Login Troubleshooting
rvw-000252,play.google.com,Google Play (com.openlane.mobile.carsarriveplus),https://play.google.com/store/apps/details?id=com.openlane.mobile.carsarriveplus&hl=en&gl=us,google_play_us_store,jackie perez,2023-09-07,1,negative,"having issues submitting paperwork, too many steps and app always freezes",Account / Access / Login,Password Reset & Login Troubleshooting,App Login Troubleshooting
rvw-000393,play.google.com,Google Play (com.nthgensoftware.traderev.android),https://play.google.com/store/apps/details?id=com.nthgensoftware.traderev.android&hl=en&gl=us,google_play_us_store,Paul Buhler,2023-08-27,1,negative,"Terrible app, I thought the traderev app was bad but this is a new level. Pretty hard to do business with the app when nothing works. Hire a new developer and get this thing sorted out.",Account / Access / Login,Password Reset & Login Troubleshooting,App Login Troubleshooting
rvw-000253,play.google.com,Google Play (com.nthgensoftware.traderev.android),https://play.google.com/store/apps/details?id=com.nthgensoftware.traderev.android&hl=en&gl=us,google_play_us_store,Paul Buhler,2023-08-26,1,negative,"Terrible app, I thought the traderev app was bad but this is a new level. Pretty hard to do business with the app when nothing works. Hire a new developer and get this thing sorted out.",Account / Access / Login,Password Reset & Login Troubleshooting,App Login Troubleshooting
rvw-000254,play.google.com,Google Play (com.backlotcars.backlotcars),https://play.google.com/store/apps/details?id=com.backlotcars.backlotcars&hl=en&gl=us,google_play_us_store,john mccauley,2023-08-19,1,negative,Just states error when I try to login. I can login with browser but no using this app.,Account / Access / Login,Password Reset & Login Troubleshooting,App Login Troubleshooting
rvw-000255,play.google.com,Google Play (com.nthgensoftware.traderev.android),https://play.google.com/store/apps/details?id=com.nthgensoftware.traderev.android&hl=en&gl=us,google_play_us_store,Geoff Walton,2023-08-19,1,negative,App does not work correctly. It's like they didn't want it to work on your phone. Not even functional in its current state.,Account / Access / Login,Password Reset & Login Troubleshooting,App Login Troubleshooting
rvw-000256,apps.apple.com,"Apple App Store (1186571028, us)",https://itunes.apple.com/us/review?id=1186571028&type=Purple%20Software&reviewId=10273650041,apple_us_store,ViktorCS,2023-08-18,4,positive,"Update- IPhone 14 Pro Max. Active inspection specialist. I’m upgrading my phone and got one from a friend of mine for a test run, and I have to be almost a foot away from the ViN to scan it. Vs my old iPhone 12, I can vary between 1in to 6in away and it will be clear and scan just fine. Just hoping for an update that fixes the “auto focus” in the app for these newer iPhones to be used for inspecting. Thank you!!","Lot Condition, Listing Status and related",Third-Party Inspection Authorization & Scheduling,Previewing/ Inspecting Vehicles
rvw-000257,play.google.com,Google Play (com.backlotcars.backlotcars),https://play.google.com/store/apps/details?id=com.backlotcars.backlotcars&hl=en&gl=us,google_play_us_store,Travis Griffis,2023-08-16,1,negative,"In app the search filter options do not work. You narrow down location it shows vehicles all over. You narrow down price it shows all price ranges etc. Very buggy very difficult to use. The only times I've ever used it to bid, resulted in negative experiences such as my bid being canceled and being outbid for something I should've been the top bidder for.",Account / Access / Login,Password Reset & Login Troubleshooting,App Login Troubleshooting
rvw-000394,play.google.com,Google Play (com.backlotcars.backlotcars),https://play.google.com/store/apps/details?id=com.backlotcars.backlotcars&hl=en&gl=us,google_play_us_store,Jay Hohlfeld,2023-08-11,2,negative,Watch out for police changes that you have to agree to immediately or can not continue to the app. The company is looking for new ways to get buyers to pay more money. Back button always wants you to sign out that is annoying also.,Account / Access / Login,Password Reset & Login Troubleshooting,App Login Troubleshooting
rvw-000258,play.google.com,Google Play (com.backlotcars.backlotcars),https://play.google.com/store/apps/details?id=com.backlotcars.backlotcars&hl=en&gl=us,google_play_us_store,Jay Hohlfeld,2023-08-10,2,negative,Watch out for police changes that you have to agree to immediately or can not continue to the app. The company is looking for new ways to get buyers to pay more money. Back button always wants you to sign out that is annoying also.,Account / Access / Login,Password Reset & Login Troubleshooting,App Login Troubleshooting
rvw-000259,play.google.com,Google Play (com.openlane.mobile.carsarriveplus),https://play.google.com/store/apps/details?id=com.openlane.mobile.carsarriveplus&hl=en&gl=us,google_play_us_store,Mike Romo,2023-08-10,1,negative,if would be alot better if it would be able to scan just the vin#. alot of times we have to punch it manually and it take like 20min just to confirm vin#. letiimg us transporters do more loads. and it take alot of out time specially when repo yards open from a certain to a certain time. and we lose loads. alot of repo yards give sometime windows of 2hrs only when we have to punch 17 vin#. we lose loads and our eta look bad.,"Vehicle Pickup, Delivery and Scheduling",Delivery Coordination & Handoffs,Delivery Status and ETA
rvw-000260,play.google.com,Google Play (com.openlane.mobile.carsarriveplus),https://play.google.com/store/apps/details?id=com.openlane.mobile.carsarriveplus&hl=en&gl=us,google_play_us_store,Rian Wilson,2023-08-10,2,negative,show lower price on app than website and will not show all units available.,Account / Access / Login,Password Reset & Login Troubleshooting,App Login Troubleshooting
rvw-000261,play.google.com,Google Play (com.openlane.mobile.carsarriveplus),https://play.google.com/store/apps/details?id=com.openlane.mobile.carsarriveplus&hl=en&gl=us,google_play_us_store,Taha Mousa,2023-08-08,5,positive,Very easy to use and one of the best apps currently on the auto hauling app.,Account / Access / Login,Password Reset & Login Troubleshooting,App Login Troubleshooting
rvw-000262,apps.apple.com,"Apple App Store (1566419386, us)",https://itunes.apple.com/us/review?id=1566419386&type=Purple%20Software&reviewId=10234779509,apple_us_store,Oleganator1,2023-08-08,1,negative,"Useless App. What a waste of driver’s time… why can’t you all just use Super Dispatch like every other good company does, not only it’s frustrating for the fact that a driver got to use two apps but your apps don’t work half of the time. Everyone already switched to super dispatch quick and easy way to do things, no they got to be special inconsiderate selfish pricks to create problems for the people they work with. You should be ashamed of yourselves as I am sure you spouses are if you even have one, probably not cause no decent man or woman would want to be with such inconsiderate selfish people… hopefully it hits home for those in charge and they actually ask people they work with what would be a good way to do this instead of just pushing their selfish agenda onto people… if you have a way not use this app don’t waste your time…",Membership / Licensing / Fees & Bidding Policies,"Bidding Process, Rules and Fees",Fees
rvw-000263,play.google.com,Google Play (com.nthgensoftware.traderev.android),https://play.google.com/store/apps/details?id=com.nthgensoftware.traderev.android&hl=en&gl=us,google_play_us_store,Natasha Larsen,2023-08-03,1,negative,"Update: new app- oh it will work right? Wrong. Same thing. I can't even open the app. It's not android friendly, when it does work- I can't scan Vins in the door to park a car. Horrible app",Account / Access / Login,Password Reset & Login Troubleshooting,App Login Troubleshooting
rvw-000395,play.google.com,Google Play (com.backlotcars.backlotcars),https://play.google.com/store/apps/details?id=com.backlotcars.backlotcars&hl=en&gl=us,google_play_us_store,Brian,2023-07-25,1,negative,"Doesn't get past the ""splash"" screen for a couple of months already. That makes it hard for me to bid on cars, not a good thing for an auction.",Membership / Licensing / Fees & Bidding Policies,"Bidding Process, Rules and Fees",Fees
rvw-000264,play.google.com,Google Play (com.backlotcars.backlotcars),https://play.google.com/store/apps/details?id=com.backlotcars.backlotcars&hl=en&gl=us,google_play_us_store,Brian,2023-07-24,1,negative,"Doesn't get past the ""splash"" screen for a couple of months already. That makes it hard for me to bid on cars, not a good thing for an auction.",Membership / Licensing / Fees & Bidding Policies,"Bidding Process, Rules and Fees",Fees
rvw-000265,play.google.com,Google Play (com.nthgensoftware.traderev.android),https://play.google.com/store/apps/details?id=com.nthgensoftware.traderev.android&hl=en&gl=us,google_play_us_store,Nakul Sharma,2023-07-24,1,negative,"Quite simply the most non user friendly app. Since they updated it from Traderev, the layout is small, unreadable and there is major lag while using the app.",Account / Access / Login,Password Reset & Login Troubleshooting,App Login Troubleshooting
rvw-000396,play.google.com,Google Play (com.nthgensoftware.traderev.android),https://play.google.com/store/apps/details?id=com.nthgensoftware.traderev.android&hl=en&gl=us,google_play_us_store,Auto District,2023-07-24,1,negative,"Absolutely disaster. So many bugs and glitches that more than 90% of the time it fails to deliver what it is meant for. They ruined all the traderev experience. In this AI world, they need to ramp up the game big big time. Absolutely JOKE !!",Account / Access / Login,Password Reset & Login Troubleshooting,App Login Troubleshooting
rvw-000266,play.google.com,Google Play (com.nthgensoftware.traderev.android),https://play.google.com/store/apps/details?id=com.nthgensoftware.traderev.android&hl=en&gl=us,google_play_us_store,Auto District,2023-07-23,1,negative,"Absolutely disaster. So many bugs and glitches that more than 90% of the time it fails to deliver what it is meant for. They ruined all the traderev experience. In this AI world, they need to ramp up the game big big time. Absolutely JOKE !!",Account / Access / Login,Password Reset & Login Troubleshooting,App Login Troubleshooting
rvw-000267,play.google.com,Google Play (com.nthgensoftware.traderev.android),https://play.google.com/store/apps/details?id=com.nthgensoftware.traderev.android&hl=en&gl=us,google_play_us_store,Connor Jacobs,2023-07-20,1,negative,"Absolute embarrassment. You took a completely stable and usable platform with TradeRev and completely crippled it making it less user friendly and unstable. Continuous crashes, bugs, and glitches on every use. If your intent was to have users try other platforms such as Eblock, then you succeeded perfectly. I am a long time android user and this is by far the worst revision and app I have used. Each iteration becomes more bloated and slow to load vehicle detail pages.","Vehicle Pickup, Delivery and Scheduling",Delivery Coordination & Handoffs,Delivery Status and ETA
rvw-000268,play.google.com,Google Play (com.nthgensoftware.traderev.android),https://play.google.com/store/apps/details?id=com.nthgensoftware.traderev.android&hl=en&gl=us,google_play_us_store,Twisted Brother Chasing,2023-07-18,1,negative,The new OpenLane is a terrible platform. Took a very good app (TradeRev) and destroyed it basically. Very obvious they never consulted any heavy users as they removed so many features that were used daily. Been a month since the launch and not one thing has been fixed. Do not recommend,Account / Access / Login,Password Reset & Login Troubleshooting,App Login Troubleshooting
rvw-000397,play.google.com,Google Play (com.backlotcars.backlotcars),https://play.google.com/store/apps/details?id=com.backlotcars.backlotcars&hl=en&gl=us,google_play_us_store,bryan chapman,2023-07-18,1,negative,Keeps crashing. First time downloaded.,Account / Access / Login,Password Reset & Login Troubleshooting,App Login Troubleshooting
rvw-000269,play.google.com,Google Play (com.backlotcars.backlotcars),https://play.google.com/store/apps/details?id=com.backlotcars.backlotcars&hl=en&gl=us,google_play_us_store,bryan chapman,2023-07-17,1,negative,Keeps crashing. First time downloaded.,Account / Access / Login,Password Reset & Login Troubleshooting,App Login Troubleshooting
rvw-000270,play.google.com,Google Play (com.nthgensoftware.traderev.android),https://play.google.com/store/apps/details?id=com.nthgensoftware.traderev.android&hl=en&gl=us,google_play_us_store,Jorge Solorzano,2023-07-15,1,negative,Worst app in the history of apps. Should have left things as they were or test for months before launching. This app is hurting both buyers and sellers. Need to support another auction it looks like.,Customer Service & Communication,Agent Professionalism & Responsiveness,Rude/Unhelpful Support
rvw-000271,play.google.com,Google Play (com.openlane.mobile.carsarriveplus),https://play.google.com/store/apps/details?id=com.openlane.mobile.carsarriveplus&hl=en&gl=us,google_play_us_store,Brad Mayher,2023-07-15,1,negative,most garbage app ever never accepts loads without order id you won't get 10 percent loads thank God for Central having the load id,Account / Access / Login,Password Reset & Login Troubleshooting,App Login Troubleshooting
rvw-000272,play.google.com,Google Play (com.nthgensoftware.traderev.android),https://play.google.com/store/apps/details?id=com.nthgensoftware.traderev.android&hl=en&gl=us,google_play_us_store,Jonathan Reeves,2023-07-12,1,negative,Cant use. App crashes since merge with adesa. Sucks,Account / Access / Login,Password Reset & Login Troubleshooting,App Login Troubleshooting
