id,source_website,source_label,source_url,geo_validation,author,review_date,rating,sentiment,review_text,tier1,tier2,tier3
rvw-000355,play.google.com,Google Play (com.backlotcars.backlotcars),https://play.google.com/store/apps/details?id=com.backlotcars.backlotcars&hl=en&gl=us,google_play_us_store,Omar J,2025-11-04,1,negative,"new issue, it says theres over 900 cars but shows only 15 ! Also the app was running perfectly fine for years, until someone decided to think and turned everything for the worse. So when browsing through the car list, if you enter a car’s details and then return to the list, it automatically brings you back to the top of the list instead of where you left off. For the development department or personal, please don't think again because your update is bad and the app is way slower than before.","Vehicle Pickup, Delivery and Scheduling",Delivery Coordination & Handoffs,Delivery Status and ETA
rvw-000067,play.google.com,Google Play (com.backlotcars.backlotcars),https://play.google.com/store/apps/details?id=com.backlotcars.backlotcars&hl=en&gl=us,google_play_us_store,Omar J,2025-11-03,1,negative,"new issue, it says theres over 900 cars but shows only 15 ! Also the app was running perfectly fine for years, until someone decided to think and turned everything for the worse. So when browsing through the car list, if you enter a car’s details and then return to the list, it automatically brings you back to the top of the list instead of where you left off. For the development department or personal, please don't think again because your update is bad and the app is way slower than before.","Vehicle Pickup, Delivery and Scheduling",Delivery Coordination & Handoffs,Delivery Status and ETA
rvw-000068,trustpilot.com,Trustpilot (openlane.com),https://www.trustpilot.com/reviews/68f8f2f20432471b2684e708,trustpilot_us_slug,WJB,2025-10-22,1,negative,Selling a car and refusing to prove the…. Selling a car and refusing to prove the state it's in by posting or sending pictures of workstatements. Anonymous employees answering that you first need to buy a classic car before you're allowed to inspect it. Stupidity.,"Lot Condition, Listing Status and related",Third-Party Inspection Authorization & Scheduling,Previewing/ Inspecting Vehicles
rvw-000356,play.google.com,Google Play (com.nthgensoftware.traderev.android),https://play.google.com/store/apps/details?id=com.nthgensoftware.traderev.android&hl=en&gl=us,google_play_us_store,Jaff W,2025-10-22,1,negative,"Total scams, this is one of the worst app ever made. the slowest most sluggish up of all times. The team behind this app is ******. The auction itself has become a total scam. From high buy fees to limited arbitration and arbitration fee for invalid arbs, and they decide whether it is valid or invalid. You have to pay a monthly fee and then and then they scam you with mandatory transport, which is absolutely a scam. A buyer should have the option to choose how to transport their own purchase.",Customer Service & Communication,Agent Professionalism & Responsiveness,Rude/Unhelpful Support
rvw-000069,play.google.com,Google Play (com.nthgensoftware.traderev.android),https://play.google.com/store/apps/details?id=com.nthgensoftware.traderev.android&hl=en&gl=us,google_play_us_store,Jaff W,2025-10-21,1,negative,"Total scams, this is one of the worst app ever made. the slowest most sluggish up of all times. The team behind this app is ******. The auction itself has become a total scam. From high buy fees to limited arbitration and arbitration fee for invalid arbs, and they decide whether it is valid or invalid. You have to pay a monthly fee and then and then they scam you with mandatory transport, which is absolutely a scam. A buyer should have the option to choose how to transport their own purchase.",Customer Service & Communication,Agent Professionalism & Responsiveness,Rude/Unhelpful Support
rvw-000070,bbb.org,BBB Complaints,https://www.bbb.org/us/in/carmel/profile/car-dealers/openlane-inc-0382-90024496/complaints#0382_90024496_24045899,bbb_us_business,BBB complainant,2025-10-21,1,negative,"Service or Repair Issues. We A Bought 2019 REMOVED Trax Order W537969 in good faith with no known issues per their inspection.Once we get in it starts to run hot,so we took our mechanic and called arbitration ,because of a blown head gasket and now it needs a motor .There arbitration refuses to do anything and have horrible attitudes.Dealers beware of all the crooked dealers selling cars on thier site with no repercussions for selling bad cars and no turn REMOVED very disappointed on how our arbitration was handled and will probale never do business again with them Again","Lot Condition, Listing Status and related",Third-Party Inspection Authorization & Scheduling,Previewing/ Inspecting Vehicles
rvw-000071,play.google.com,Google Play (com.openlane.mobile.carsarriveplus),https://play.google.com/store/apps/details?id=com.openlane.mobile.carsarriveplus&hl=en&gl=us,google_play_us_store,Oskar Piotrzkowski,2025-10-20,1,negative,keeps telling me to update the app after I just updated it. Uninstalled and reinstalled it and still nothing,Account / Access / Login,Password Reset & Login Troubleshooting,App Login Troubleshooting
rvw-000072,play.google.com,Google Play (com.openlane.mobile.carsarriveplus),https://play.google.com/store/apps/details?id=com.openlane.mobile.carsarriveplus&hl=en&gl=us,google_play_us_store,Bolor Bayaraa,2025-10-19,1,negative,App wise really difficult to use. Asks for update all the time when new update is not available thus can't use the app.,Account / Access / Login,Password Reset & Login Troubleshooting,App Login Troubleshooting
rvw-000073,play.google.com,Google Play (com.openlane.mobile.carsarriveplus),https://play.google.com/store/apps/details?id=com.openlane.mobile.carsarriveplus&hl=en&gl=us,google_play_us_store,A Baker,2025-10-15,1,negative,Trash I wish I could leave 5 negative stars. you can't pick multiple states every time you select a load you have to put all the info back in on website.. app freeze on last picture.. need to put unavailable to sign on pickup option... call me if you need help please im sick of this app and website. use to be my favorite and put load alert also.. This site still trash every time you go out the site you have to start over putting city and state back in. You can't click on multiple cities..,Account / Access / Login,Password Reset & Login Troubleshooting,App Login Troubleshooting
rvw-000074,play.google.com,Google Play (com.nthgensoftware.traderev.android),https://play.google.com/store/apps/details?id=com.nthgensoftware.traderev.android&hl=en&gl=us,google_play_us_store,Sahab,2025-10-08,1,negative,every time new update comes and gives more problems. its getting worse and worse I don't know that they're doing with this app day by day,Account / Access / Login,Password Reset & Login Troubleshooting,App Login Troubleshooting
rvw-000357,play.google.com,Google Play (com.nthgensoftware.traderev.android),https://play.google.com/store/apps/details?id=com.nthgensoftware.traderev.android&hl=en&gl=us,google_play_us_store,Brett Leggat,2025-10-08,1,negative,It's amazing. it's like with every app update it gets worse. Check the history of reviews. Same complaints for YEARS and openlane doesn't do anything about it. fire the whole app team and hire people with knowledge. also help center absolutely useless.,Customer Service & Communication,Agent Professionalism & Responsiveness,Rude/Unhelpful Support
rvw-000075,play.google.com,Google Play (com.nthgensoftware.traderev.android),https://play.google.com/store/apps/details?id=com.nthgensoftware.traderev.android&hl=en&gl=us,google_play_us_store,Brett Leggat,2025-10-07,1,negative,It's amazing. it's like with every app update it gets worse. Check the history of reviews. Same complaints for YEARS and openlane doesn't do anything about it. fire the whole app team and hire people with knowledge. also help center absolutely useless.,Customer Service & Communication,Agent Professionalism & Responsiveness,Rude/Unhelpful Support
rvw-000076,play.google.com,Google Play (com.nthgensoftware.traderev.android),https://play.google.com/store/apps/details?id=com.nthgensoftware.traderev.android&hl=en&gl=us,google_play_us_store,Michael Lapolla,2025-10-03,1,negative,so glitchy and slow,Account / Access / Login,Password Reset & Login Troubleshooting,App Login Troubleshooting
rvw-000077,play.google.com,Google Play (com.openlane.mobile.carsarriveplus),https://play.google.com/store/apps/details?id=com.openlane.mobile.carsarriveplus&hl=en&gl=us,google_play_us_store,"nadeem ,",2025-10-02,1,negative,one of the worst app,Account / Access / Login,Password Reset & Login Troubleshooting,App Login Troubleshooting
rvw-000078,apps.apple.com,"Apple App Store (1186571028, us)",https://itunes.apple.com/us/review?id=1186571028&type=Purple%20Software&reviewId=13215003125,apple_us_store,Danish31567,2025-10-02,1,negative,Very buggy too many screens. App glitches and crashes all the time. Has too many screens to complete even basic task. Pop up notifications while in app linger way too long and it won’t let you swipe them away. App forces you to entered same info repeatedly if you minimize app or open different app. Bluetooth connectivity hit or miss.,Account / Access / Login,Password Reset & Login Troubleshooting,App Login Troubleshooting
rvw-000358,apps.apple.com,"Apple App Store (1186571028, us)",https://apps.apple.com/us/app/id1186571028?see-all=reviews&platform=iphone&reviewId=13215003125,apple_us_store,Danish31567,2025-10-02,1,negative,Very buggy too many screens. App glitches and crashes all the time. Has too many screens to complete even basic task. Pop up notifications while in app linger way too long and it won’t let you swipe them away. App forces you to entered same info repeatedly if you minimize app or open different app. Bluetooth connectivity hit or miss,Account / Access / Login,Password Reset & Login Troubleshooting,App Login Troubleshooting
rvw-000079,play.google.com,Google Play (com.nthgensoftware.traderev.android),https://play.google.com/store/apps/details?id=com.nthgensoftware.traderev.android&hl=en&gl=us,google_play_us_store,Dan S,2025-10-01,1,negative,"app is so unstable using s25 ultra, it's so buggy. saved searches when selecting more then one car will go blank I have to delete data storage for it to work again only for short period then it will bug again, I can't submit arbitrations only on PC, even trying to chat support is impossible if phone closes for a second the support chat is lost. app is just overall super slow and unresponsive especially in the morning when most cars are closing its impossible to put a bid in.",Customer Service & Communication,Agent Professionalism & Responsiveness,Rude/Unhelpful Support
rvw-000080,apps.apple.com,"Apple App Store (1186571028, us)",https://itunes.apple.com/us/review?id=1186571028&type=Purple%20Software&reviewId=13197986339,apple_us_store,Kirkwood Red,2025-09-28,1,negative,OPENLANE app. App refuses to redownload on my phone please fix,Account / Access / Login,Password Reset & Login Troubleshooting,App Login Troubleshooting
rvw-000359,birdeye.com,Birdeye (Google),https://reviews.birdeye.com/openlane-166516131772584#review-5,birdeye_us_profile,Tamer Helal,2025-09-26,,positive,"The best Auction I’ve ever used to buy cars. Super easy to use, the inspiration is accurate. Also my Rep. Favi Montes is so helpful and very easy to work with. So responsive and she calls sellers to negotiate with them to get me the best deal, I really recommend Openlane to any dealership.",Customer Service & Communication,Agent Professionalism & Responsiveness,Helpful Support Experience
rvw-000081,apps.apple.com,"Apple App Store (1566419386, us)",https://itunes.apple.com/us/review?id=1566419386&type=Purple%20Software&reviewId=13171180867,apple_us_store,angelo custody,2025-09-22,3,positive,"Better car app, but could improve. The app is functional but when comparing it to Super Dispatch, it falls short in search capabilities and for actual performance when trying to upload photos and access a BOL.",Account / Access / Login,Document Upload & Verification,Upload Troubleshooting
rvw-000082,trustpilot.com,Trustpilot (openlane.com),https://www.trustpilot.com/reviews/68cf021c4d19bb095b5206c4,trustpilot_us_slug,Brad R,2025-09-20,1,negative,"OPENLANE- THE WORST. OPENLANE and District sales manager Eric Carette (a weasel in my opinion) banned a buyer because the seller failed to disclose in the listing- vehicle has no cabin heat, vehicle overheats and vehicle needs towed. After it overheated in just 10 Kms (6 miles) After letting it cool down on the side of the road it was returned to the seller, so they nor Openlane suffered any damages. When I requested the sale just get cancelled, Openlane refused and said the vehicle was drivable! Frickin' morons in my opinion. So in my opinion Openlane and Eric Carette have no morals, ethics, integrity or common sense. BUYERS BEWARE of the tactics at Openlane and the desperation to stick a buyer with a vehicle that had no mechanical disclosures and can't be driven more than 6 miles! In my opinion Openlane is the worst of all the dealer auctions. Just read the reviews from various sources on the web.",Customer Service & Communication,Agent Professionalism & Responsiveness,Rude/Unhelpful Support
rvw-000083,birdeye.com,Birdeye (Google),https://reviews.birdeye.com/openlane-166516131772584#review-5,birdeye_us_profile,Tamer Helal,2025-09-19,,positive,"The best Auction I’ve ever used to buy cars. Super easy to use, the inspiration is accurate. Also my Rep. Favi Montes is so helpful and very easy to work with. So responsive and she calls sellers to negotiate with them to get me the best deal, I really recommend Openlane to any dealership.",Customer Service & Communication,Agent Professionalism & Responsiveness,Helpful Support Experience
rvw-000084,birdeye.com,Birdeye (Google),https://reviews.birdeye.com/openlane-166516131772584?page=2#review-5,birdeye_us_profile,Tamer Helal,2025-09-19,,positive,"The best Auction I’ve ever used to buy cars. Super easy to use, the inspiration is accurate. Also my Rep. Favi Montes is so helpful and very easy to work with. So responsive and she calls sellers to negotiate with them to get me the best deal, I really recommend Openlane to any dealership.",Customer Service & Communication,Agent Professionalism & Responsiveness,Helpful Support Experience
rvw-000085,play.google.com,Google Play (com.backlotcars.backlotcars),https://play.google.com/store/apps/details?id=com.backlotcars.backlotcars&hl=en&gl=us,google_play_us_store,Kelley Williams,2025-09-18,1,negative,New update is terrible. Can not reject offers from app. UPDATE 9/18/25 APP IS STILL TERRIBLE!,Account / Access / Login,Password Reset & Login Troubleshooting,App Login Troubleshooting
rvw-000086,bbb.org,BBB Complaints,https://www.bbb.org/us/in/carmel/profile/car-dealers/openlane-inc-0382-90024496/complaints#0382_90024496_23904597,bbb_us_business,BBB complainant,2025-09-18,1,negative,"Service or Repair Issues. Hello, my name is REMOVED with REMOVED . Openlane is an online auction I use. The reason why I started using them is because they send inspectors out to inspect the vehicles, to tell you everything wrong with the vehicles (dents, scratches, cleanliness, mechanics, etc). There is also a $75.00 charge for this service. I purchased a 2012 GMC Terrain from them on 08/14/2025 and the inspector put in his report, that everything was fine on this vehicle, except a dent on the driver's side rear and a scratch on the rear bumper. No mechanical issues were mentioned. When I went to pick up this vehicle, I first noticed three large dents & cracked windshield that was not mentioned and the vehicle has several mechanical issues (a/c, timing chain, head gaskets, engine noise). I told them I didn't want the vehicle because it was misrepresented and they are telling me no. I also offered to pay for another inspector to check out the vehicle because I fill that there inspector didn't do his job. I told them, we can get a third party inspector to check it out, and if there are no issues, I will take the vehicle but they refused. I paid $5900.00 for this vehicle, which is above wholesale market value because I thought there were no issues and I could sell it right away. The vehicle is still sitting at REMOVED because I have never taken possession of it. I don't want it even if they give it to me for free. the amount of money and time I would have to put in it, it is not worth it. Just want to be refunded. I will not buy from them REMOVED .","Payment Refunds, Transaction Issues and Deposits",Refunds & Membership Billing,Deposit Refund Status
rvw-000087,play.google.com,Google Play (com.nthgensoftware.traderev.android),https://play.google.com/store/apps/details?id=com.nthgensoftware.traderev.android&hl=en&gl=us,google_play_us_store,Jose J,2025-09-16,1,negative,"Glitchy and unstable. Get ""failed to upload"" messages when uploading cars quite often on my android. Re uploading does not fix this error. This forces the user to begin the process again from scratch.",Account / Access / Login,Document Upload & Verification,Upload Troubleshooting
rvw-000088,apps.apple.com,"Apple App Store (1566419386, us)",https://itunes.apple.com/us/review?id=1566419386&type=Purple%20Software&reviewId=13146398478,apple_us_store,Joseccce,2025-09-16,1,negative,Its so complicated. I cant find the vehicle that was dispatched to me,"Vehicle Pickup, Delivery and Scheduling",Scheduled Pickup Status,Missed/ Delayed Pickup and Dispatch Window
rvw-000089,play.google.com,Google Play (com.openlane.mobile.carsarriveplus),https://play.google.com/store/apps/details?id=com.openlane.mobile.carsarriveplus&hl=en&gl=us,google_play_us_store,Jeff Ball,2025-09-08,2,negative,too complicated...need to do damages as pics taken. should not have to walk around twice.,"Lot Condition, Listing Status and related",Lot Condition Reporting,Lot Damage
rvw-000090,apps.apple.com,"Apple App Store (1566419386, us)",https://itunes.apple.com/us/review?id=1566419386&type=Purple%20Software&reviewId=13096074554,apple_us_store,Buc 1223,2025-09-03,1,negative,Owner. The worst app in the industry.,Account / Access / Login,Password Reset & Login Troubleshooting,App Login Troubleshooting
rvw-000091,apps.apple.com,"Apple App Store (1566419386, us)",https://itunes.apple.com/us/review?id=1566419386&type=Purple%20Software&reviewId=13076160007,apple_us_store,Dakohta o,2025-08-29,1,negative,Horrible app. Only works when it wants to!,Account / Access / Login,Password Reset & Login Troubleshooting,App Login Troubleshooting
rvw-000092,apps.apple.com,"Apple App Store (1175036411, us)",https://itunes.apple.com/us/review?id=1175036411&type=Purple%20Software&reviewId=13020981142,apple_us_store,Hewittsauto,2025-08-15,1,negative,Don’t bother. Three cars in a row had bad frames. First car on me as the cost was below the 6000 mark. Next Silverado purchased over 10000$ Truck showed up and was a complete piece of junk. OPENLANE bought it back. Third vehicle bought with guarantees. Upon inspection found massive hole in the frame. This time told deal with it. What’s the point of the guarantee if they aren’t honored.,"Lot Condition, Listing Status and related",Third-Party Inspection Authorization & Scheduling,Previewing/ Inspecting Vehicles
rvw-000360,play.google.com,Google Play (com.openlane.mobile.carsarriveplus),https://play.google.com/store/apps/details?id=com.openlane.mobile.carsarriveplus&hl=en&gl=us,google_play_us_store,Shelly Williams,2025-08-12,1,negative,you have to do too many security checks when already in the app. there's no way to document damage on rvs and boats,Account / Access / Login,Document Upload & Verification,Upload Troubleshooting
rvw-000093,play.google.com,Google Play (com.openlane.mobile.carsarriveplus),https://play.google.com/store/apps/details?id=com.openlane.mobile.carsarriveplus&hl=en&gl=us,google_play_us_store,Shelly Williams,2025-08-11,1,negative,you have to do too many security checks when already in the app. there's no way to document damage on rvs and boats,Account / Access / Login,Document Upload & Verification,Upload Troubleshooting
rvw-000094,trustpilot.com,Trustpilot (openlane.com),https://www.trustpilot.com/reviews/68976a7a796b14201444fe38,trustpilot_us_slug,Mike Kamper,2025-08-09,1,negative,I've bought over 2000 vehicles in last…. I've bought over 2000 vehicles in last 5 years..they changed there policy to under 6k they wont cover any body damage missed including the frame. Recently bought a colorado truck with all green check marks and anyone that knows colorado trucks have major issues with frames. I get the truck noticed something hanging down without even trying to look and it was the frame pulling apart. I called and they denied the claim saying to bad to sad your fd. This company is a absolute joke . Tyler vansicle claimed there not a auction lmao and its all over there website saying auction .. They make about 200k a year of me alone is the thing and still wont help. Cant get a call back unless they need something its a total scam ..im moving to ACv or just stick with auctions that care and stand behind what is said not yes our professional inspector missed thst and you get screwed. I dont get how this is legal . Everyone needs to team up and start a class action law suite. The inspectors I guarantee from a good source get paid under the table to over look huge issues by dealership. This company is going down and I guarantee I wont stop until they get punished . I dont have 500 million in the bank they will ruin a small business in no time . They get 0 stars . K&K Auto Sales.,Customer Service & Communication,Communication Follow-up & Escalation,No Callback / Unresolved Case
rvw-000361,play.google.com,Google Play (com.backlotcars.backlotcars),https://play.google.com/store/apps/details?id=com.backlotcars.backlotcars&hl=en&gl=us,google_play_us_store,ronald Lam,2025-08-05,2,negative,Too many bugs now it doesn't show transport cost only when I check out!! sometimes screen goes blank when going back to previous page..,Membership / Licensing / Fees & Bidding Policies,"Bidding Process, Rules and Fees",Fees
rvw-000095,play.google.com,Google Play (com.backlotcars.backlotcars),https://play.google.com/store/apps/details?id=com.backlotcars.backlotcars&hl=en&gl=us,google_play_us_store,ronald Lam,2025-08-04,2,negative,Too many bugs now it doesn't show transport cost only when I check out!! sometimes screen goes blank when going back to previous page..,Membership / Licensing / Fees & Bidding Policies,"Bidding Process, Rules and Fees",Fees
rvw-000096,trustpilot.com,Trustpilot (openlane.com),https://www.trustpilot.com/reviews/688bf081ca0ab5ed2872fa20,trustpilot_us_slug,james,2025-08-01,1,negative,"I have been a dealer for over 12 years…. I have been a dealer for over 12 years and buying from an open source like Backlots, now Openlane was a great option. However, the last few years have been less than good. They keep adding items that they won't cover, which is a lot now, so please read their arb polices before even thinking of using this platform. They have paid people that inspect the units posted online, it seems that the inspectors don't note issues that Openline won't cover which help to get top dollar for the franchise stores. If you look at the BBB, Openline has a F rating due to not responding to issues. I have bought 100's of units through their site and when there was an issue they would pay me back a portion of the cost to fix it like it was my fault the unit had a problem but now they won't even do that.....Not saying to not use them but know what you are getting into, if you can't afford to eat repairs, don't use this site. I would say I avg around 1 out 3 units had issues not noted.",Customer Service & Communication,Communication Follow-up & Escalation,No Callback / Unresolved Case
rvw-000097,apps.apple.com,"Apple App Store (1566419386, us)",https://itunes.apple.com/us/review?id=1566419386&type=Purple%20Software&reviewId=12963782831,apple_us_store,tataresti,2025-08-01,1,negative,"This is the worst app. I’ve been working for five years delivering cars, howling cars and this is by far the worst app. Every time I deliver a vehicle I hit submit. I take the pictures I hit submit and it doesn’t show me that the vehicle have to go all over again. Take all the pictures and send it again, and the pictures are not clear and just loading half an hour the worst I ever seen and they haven’t changed in five years",Account / Access / Login,Password Reset & Login Troubleshooting,App Login Troubleshooting
rvw-000098,play.google.com,Google Play (com.openlane.mobile.carsarriveplus),https://play.google.com/store/apps/details?id=com.openlane.mobile.carsarriveplus&hl=en&gl=us,google_play_us_store,Wth Happened,2025-07-31,2,negative,super slow and glitches. Terrible format compared to all the other apps im forced to use during the work day,Account / Access / Login,Password Reset & Login Troubleshooting,App Login Troubleshooting
rvw-000099,play.google.com,Google Play (com.openlane.mobile.carsarriveplus),https://play.google.com/store/apps/details?id=com.openlane.mobile.carsarriveplus&hl=en&gl=us,google_play_us_store,"Stepneys Towing, LLC",2025-07-30,2,negative,location be off. you can be at your delivery location try and submit your delivery and it will say you aren't at the location.,"Vehicle Pickup, Delivery and Scheduling",Scheduled Pickup Status,Missed/ Delayed Pickup and Dispatch Window
